{
  "action_type": "provision",
  "tenant_id": "tenant-123",
  "created_at": "2026-01-05T00:00:00Z",
  "correlation_id": "corr-456",
  "run_id": "run-789",
  "idempotency_key": "idem-abc",
  "policy_context_id": "policy-001",
  "inputs": {
    "resource": "workspace",
    "preconditions": [
      "quota_ok"
    ]
  },
  "requested_by": {
    "actor_id": "user-42",
    "actor_type": "user",
    "role": "admin"
  },
  "required_approvals": [
    "approval-1"
  ],
  "retry_count": 0,
  "trace_link": {
    "input_snapshot_hash": "snap-001",
    "trace_id": "trace-abc"
  }
}
